,Company URL,Company Description,Date Victimised ,Number of Clicks,Status,Company_Country,Industry_Type,Personal Identifiable Information (PII),Financial Data,Healthcare Information,Employee and HR Data,Intellectual Property and Trade Secrets,Customer and Client Data,Legal Documents,Government and Defense Information,Educational Data,Credentials and Access Information,Databases,Website Data,Backup Data,Video and Surveillance Footage,Social Media Data,Utility and Infrastructure Data,Sensitive Communication
0,sirva.com,For media: contact us please. We want to provide you a link for investigating the data we have. Be ready to proof that you're working for some popular media. For others: we will provide you a full dumps a little bit later. We have over 1.5TB of do...,"02 OCT, 2023 22:59 UTC",6497,Published,United States,Real Estate,,,,,,,,,,,,,,,,,
1,cdwg.com,"data part #2 All the Nasdaq-listed corporation was able to offer was $1,100,000 dollars of the requested $80,000,000 dollars About CDW. CDW Corporation (Nasdaq: CDW) is a leading multi-brand provider of information technology solutions to busin...","11 OCT, 2023 18:40 UTC",3233,Published,,IT Services and IT Consulting,,,,,,,,,,,,,,,,,
2,cdwg.com,"data part #1 All the Nasdaq-listed corporation was able to offer was $1,100,000 dollars of the requested $80,000,000 dollars About CDW. CDW Corporation (Nasdaq: CDW) is a leading multi-brand provider of information technology solutions to busi...","11 OCT, 2023 18:38 UTC",3030,Published,,IT Services and IT Consulting,,,,,,,,,,,,,,,,,
3,foremostgroups.com,"Revenue zoominfo 500kk+ Big holding We have all legal data, budgets, forecasts, bank, finance data, salaries, insurances, passports, confidential agreements with customers, audit private info, all human resources data, all consolidation reports...","09 OCT, 2023 21:05 UTC",3333,Published,United States,Wholesale,,,,,,,,,,,,,,,,,
4,fdf.org.uk,"The Food and Drink Federation (FDF) is a membership organisation that represents and advises UK food and drink manufacturers. Passports, banks, accounting, juridic, customers and etc private data was downloaded","28 SEP, 2023 20:24 UTC",4133,Published,United Kingdom,Food and Beverage Services,,,,,,,,,,,,,,,,,
5,starplast.ft,"Starplast est située à Ester Technopole à Limoges (87) depuis Mars 2009 dans un bâtiment contemporain de 8000 m². En juin 2020 Starplast rejoint Vitalo Group. Site web : https://www.vitalo.net/ Depuis sa création en 1965, Starplast, reconnue po...","01 OCT, 2023 21:46 UTC",3993,Published,,,,,,,,,,,,,,,,,,,
6,atlantatech.edu,"Atlanta Technical College is a public technical college in Atlanta, Georgia. It is part of the Technical College System of Georgia and provides education services for Fulton and Clayton counties.","01 OCT, 2023 21:42 UTC",4004,Published,,,,,,,,,,,,,,,,,,,
7,cfsigroup.ca,"Better yet, see us in person!","11 SEP, 2023 11:04 UTC",20006,Published,Canada,Construction,,,,,,,,,,,,,,,,,
8,aquinas.qld.edu.au,Aquinas College Ashmore,"01 SEP, 2023 08:36 UTC",12167,Published,,,,,,,,,,,,,,,,,,,
9,picosoft.biz,"PicoSoft est une société de services et dingénierie informatique, qui offre une large gamme de solutions innovantes répondant aux besoins de tout type dentreprises en matire de portails dentreprise, de gestion électronique de documents et doutils dai...","06 OCT, 2023 07:31 UTC",6533,Published,,,,,,,,,,,,,,,,,,,
10,bm.co.th,Bangsaen Mahanakorn Company Limited and affiliated companies of Bangsaen Mahanakorn,"06 OCT, 2023 07:28 UTC",6333,Published,Singapore,Machinery Manufacturing,,,,,,,,,,,,,,,,,
11,eemotors.com,"Economic Electric Motors positions itself as one of the leading providers of electrical and HVAC products to customers such as Department of Defense, Department of Interior, Department of Justice, Number of Branches of State Governments, Universities...","06 OCT, 2023 07:26 UTC",5617,Published,United States,Wholesale,,,,,,,,,,,,,,,,,
12,kendrion.com,KENDRION - innovative solutions for automotive and industry Products Markets Career We focus on intelligent actuator technology to help drive the global transition towards electrification and other forms of clean energy.,"29 AUG, 2023 01:28 UTC",17147,Published,,,,,,,,,,,,,,,,,,,
13,ckgroup.com.tw,Chien Kuo Construction,"01 OCT, 2023 21:56 UTC",6618,Published,United Kingdom,Staffing and Recruiting,,,,,,,,,,,,,,,,,
14,fdf.org.uk,"The Food and Drink Federation (FDF) is a membership organisation that represents and advises UK food and drink manufacturers. Passports, banks, accounting, juridic, customers and etc private data was downloaded","28 SEP, 2023 20:24 UTC",8340,Published,,,,,,,,,,,,,,,,,,,
15,fdf.org.uk,"The Food and Drink Federation (FDF) is a membership organisation that represents and advises UK food and drink manufacturers. Passports, accounting, finance, bank, insurances and a lot of another private data","28 SEP, 2023 20:15 UTC",7972,Published,United Kingdom,Food and Beverage Services,,,,,,,,,,,,,,,,,
16,rexgroup.co.uk,"Rex Group Services Ltd is a company that operates in the Construction industry. It employs 11-20 people and has $5M-$10M of revenue. The company is headquartered in Chapletown, South Yorkshire, United Kingdom","28 SEP, 2023 19:53 UTC",7673,Published,,,,,,,,,,,,,,,,,,,
17,ezpaybuildings.net,"EZ Pay Buildings provides programs enabling consumers the ability to acquire ownership of Storage Barns, Steel Buildings, Gazebos, and more. Our dedicated sales team work towards growing the business of our partners. Our customer service representati...","28 SEP, 2023 19:48 UTC",7147,Published,United States,Financial Services,,,,,,,,,,,,,,,,,
18,palaciodosleiloes.com.br,"Considerada uma das maiores empresas de leiles do país, o Palcio dos Leiles norteou o seu sucesso baseado em competência, ética e profissionalismo.","22 SEP, 2023 21:22 UTC",6729,Published,Brasil,Administração de serviços,,,,,,,,,,,,,,,,,
19,scmh.org.tw,"Show Chwan Memorial Hospital is a medical center that provides orthopedics, neurology, obstetrics, and gynecology treatments TAINAN MUNICIPAL HOSPITAL","26 JUL, 2023 21:12 UTC",26879,Published,United States,Machinery Manufacturing,,,,,,,,,,,,,,,,,
20,pelmorex.com,"REVENUE: 200KK USD Founded in 1989, Pelmorex is a private, family-owned, international weather information and data management company. Pelmorex is located in Canada. Read More. View Company Info for Free. Who is Pelmorex. Headquarters. 2655 Brist...","22 SEP, 2023 14:45 UTC",10862,Published,Canada,Information Services,,,,,,,,,,,,,,,,,
21,payrollselectservices.com,"We downloaded all the confidential data of their company, clients, employees, partners. Confidential data of every company they serve. This includes 180 clients, personal account logins and passwords, taxes, employees, SSN, bank details, etc. Info...","20 SEP, 2023 09:37 UTC",16168,Published,,,,,,,,,,,,,,,,,,,
22,fersan.com.tr,"you are pathetic liars, we stole your data, no need to deceive your customers. and your 7500$ that you offered us can be spent on whores","17 SEP, 2023 21:46 UTC",12858,Published,,,,,,,,,,,,,,,,,,,
23,crosscity.com.au,CROSSCITY MOTORWAY PTY LTD is a private company that has been in the industry for 22 years. The company currently specializes in the Transportation/Trucking/Railroad area.,"06 JUN, 2023 10:33 UTC",27023,Published,United States,Religious Institutions,,,,,,,,,,,,,,,,,
24,floraalpina.ch,"Seminarhotel FloraAlpina, nestled in Vitznau among beautifully designed parkland, the brainchild of landscape gardener Gustav Ammann.","14 MAY, 2023 07:45 UTC",27531,Published,,,,,,,,,,,,,,,,,,,
25,osg.co.jp,"In 1968, OSG Corporation established its very first overseas subsidiary in the United States. Since then, we have built a production, sales and technical support network spanning 33 countries. All of our facilities are optimally located to serve our...","14 APR, 2023 19:57 UTC",34260,Published,United States,IT Services and IT Consulting,,,,,,,,,,,,,,,,,
26,lhh.com.my,"We distribute solely for Philip Morris (Malaysia) Sdn Bhd across Kuala Lumpur, Cheras, Klang, Kuantan and Melaka. Our world-class tobacco brands include Marlboro, Sempoerna and Chesterfield.","07 JUN, 2023 16:18 UTC",30589,Published,United States,Human Resources Services,,,,,,,,,,,,,,,,,
27,ewwanfried.de,"E-Werk Wanfried is a local power supply company with the core areas of grid, sales, power generation and energy services. The company is owned by the von Scharfenberg family in the 5th generation.","07 JUN, 2023 12:26 UTC",29613,Published,Deutschland,Renewables & Environment,,,,,,,,,,,,,,,,,
28,arcc.org,"The mission of ARCC is to provide services, deliver training, and promote innovation to support our regions school districts.","07 JUN, 2023 09:51 UTC",27579,Published,Singapore,Executive Offices,,,,,,,,,,,,,,,,,
29,aluminumsandcastingsfoundry.com,"With satisfied customers all over North America, Mahoney Foundries supplies raw, fully machined, aluminum and brass castings for many applications. Since opening our doors in 1972, we've acquired a reputation for unrivalled service, quality, integrit...","07 JUN, 2023 10:17 UTC",26669,Published,United States,Primary Metal Manufacturing,,,,,,,,,,,,,,,,,
30,metronottevigilanza.it,"Our mission is to address the issue of security at 360 degrees, proposing ourselves to companies, public bodies, small traders and private individuals. We operate in the armed private security sector, with Public Security authorization and thirty yea...","06 JUN, 2023 16:13 UTC",25554,Published,Italia,Sicurezza e investigazioni,,,,,,,,,,,,,,,,,
31,trois-i.com,"Trois I Investissements Industriels Internationaux sa is an independent, family owned holding company focused on long term investments. ‍Established in the late ‘90s in London, Trois I moved to Luxembourg in 2006, with the aim to take advantage of t...","06 JUN, 2023 15:32 UTC",43169,Published,,,,,,,,,,,,,,,,,,,
32,ykk.com,"They are the world's largest zipper manufacturer, also producing other fastening products, architectural products, plastic hardware and industrial machinery. The initials YKK stand for Yoshida Kōgyō Kabushiki gaisha branch in the USA","26 JUL, 2023 06:07 UTC",13317,Published,日本,Textile Manufacturing,,,,,,,,,,,,,,,,,
33,ohiohistory.org,"The Ohio History Fund was created to support the preservation and sharing of Ohio's heritage by funding local, regional, and statewide projects, programs, and events related to the broad sweep of the state's history and pre-history.","26 JUL, 2023 06:15 UTC",16735,Published,United States,"Museums, Historical Sites, and Zoos",,,,,,,,,,,,,,,,,
34,blackjewel l.l.c.,"We give you a unique chance to see the corporation Blackjewel LLC from the inside. This is the third large US coal company so it will be interesting. To your attention more than 500gb of documents, databases, Accounting, Audit, data of all branches...","13 JUL, 2023 13:28 UTC",30034,Published,,,,,,,,,,,,,,,,,,,
35,persingerlaw.com,"Persinger & Persinger, L.C. is a law firm in Charleston, WV with 1 attorneys selected to the Super Lawyers or Rising Stars lists.","01 AUG, 2023 04:24 UTC",13674,Published,United States,Law Practice,,,,,,,,,,,,,,,,,
36,mipe.com,"Mission Petroleum Carriers, Inc is a bulk commodity transport company operating throughout Texas and surrounding states. Mission’s primary focus is the gathering and transportation of crude oil. Based in San Antonio, Texas, Mission has been providing...","04 AUG, 2023 19:47 UTC",15680,Published,,Construction,,,,,,,,,,,,,,,,,
37,eyedoc.com.na,"Emoneko is a Namibian health and eye care company with a vision to improve the lives of Namibians through superior service and care, combined with world-class technology. Established in 2018, Emoneko is the management company overseeing the activit...","14 JUL, 2023 08:22 UTC",23460,Published,,,,,,,,,,,,,,,,,,,
38,wings.travel,"Wings has led the market in managing complex travel and support services worldwide, with particular expertise in developing markets and high-risk destinations.","09 AUG, 2023 10:50 UTC",12590,Published,Singapore,"Physical, Occupational and Speech Therapists",,,,,,,,,,,,,,,,,
39,2plan.com,"Wealth management firm in the UK. Head office administration, technology and regulatory teams provide exceptional support to all financial advisers around the country, enabling them to deliver the best possible service to clients.","09 AUG, 2023 11:17 UTC",12784,Published,United Kingdom,Financial Services,,,,,,,,,,,,,,,,,
40,chula.ac.th,"Currently, the academic administration of the Department of Industrial Engineering, Chulalongkorn University, has changed a lot from the past. to maintain modernity in academic fields and the application of knowledge and techniques to keep pace with...","09 AUG, 2023 12:10 UTC",14295,Published,,,,,,,,,,,,,,,,,,,
41,siampremier.co.th,"Providing legal advice and services to international clients, Siam Premier is a law firm in Thailand housing expert lawyers for all your business needs.","13 AUG, 2023 08:24 UTC",10290,Published,ประเทศไทย,Law Practice,,,,,,,,,,,,,,,,,
42,zain.com,Data leak,"27 AUG, 2023 21:21 UTC",7203,Published,الكويت,Telecommunications,,,,,,,,,,,,,,,,,
43,gsaenz.com.mx,The Company's line of business includes the refining of purchased raw cane sugar and sugar syrup.,"29 AUG, 2023 17:51 UTC",6511,Published,Brasil,Food & Beverages,,,,,,,,,,,,,,,,,
44,motsaot.co.il,Motsaot was founded in 1989 and is the biggest company for portable toilets in Israel.,"29 AUG, 2023 18:14 UTC",6002,Published,,,,,,,,,,,,,,,,,,,
45,michalovich.co.il,Haim Michalovitz Company Management and Entrepreneurship Ltd. is a company that specializes in the execution of prestigious projects in the field of construction.,Not found,5943,Published,,,,,,,,,,,,,,,,,,,
46,glat.zapweb.co.il,"MB Glatt Chicken Mehadrin Ltd. is a company that specializes in kosher fish, poultry and meat processing.",Not found,5755,Published,France,Real Estate,,,,,,,,,,,,,,,,,
47,ipsenlogistics.com,"We are a holding company with interests in the field of international transport services, including industrial export packing.","29 AUG, 2023 17:57 UTC",5782,Published,,,,,,,,,,,,,,,,,,,
48,commercialfluidpower.com,"Commercial Fluid Power is a one stop shop for your fluid power needs. We carry a complete line of materials and offer extensive honing and machining capabilities. And with plants in Dover & North Canton, Ohio as well as Rome, Georgia, we are convenie...","29 AUG, 2023 19:22 UTC",5478,Published,,,,,,,,,,,,,,,,,,,
49,neolaser.es,"Design and manufacturing, manufacturing and assembly... or the entire process. No matter how many stages you need us to cover, at Neolaser we advise you during the process, we adapt to your needs and we offer you a tailor-made service.","29 AUG, 2023 21:08 UTC",5468,Published,ישראל,Medical Equipment Manufacturing,,,,,,,,,,,,,,,,,
50,lamaisonmercier.com,"In 1912, Marcel Mercier, a baker in the heart of Berry launched original biscuits with regional flavors (croustade au crottin Chavignol, croquet du Berry...).","30 AUG, 2023 20:15 UTC",5074,Published,France,Agro-alimentaire,,,,,,,,,,,,,,,,,
51,aeroportlleida.cat,"L'Aeroport de Lleida-Alguaire is located 15 km from Lleida. It is located at the clau point in the northeast of the Iberian Peninsula, where a network of infrastructures converges that connects the airport with important tourist and industrial center...","30 AUG, 2023 20:39 UTC",5039,Published,España,Aviation & Aerospace,,,,,,,,,,,,,,,,,
52,mehmetceylanyapi.com.tr,"Mehmet Ceylan Yapı A.Ş., which initially set out with a store of 250 M2 with the labor and cooperation of only two people, has realized Turkey's largest single-storey building store (3,000 M2) in İzmir Konak by considering the needs of each period an...","30 AUG, 2023 21:56 UTC",4464,Published,Türkiye,Toptan Satış Yapı Malzemeleri,,,,,,,,,,,,,,,,,
53,energyinsight.co.za,"THE wholesaler for pipes and civil engineering components and have specialized in trading with steel pipes (that ALPE ""Fuchsrohr"" system) and cast iron pipes concentrated. With experience and know-how, we supply pipes together with Molded parts, acce...","30 AUG, 2023 22:26 UTC",4551,Published,United States,Environmental Services,,,,,,,,,,,,,,,,,
54,tlip2.com,"Vietnam is the focus of much attention worldwide as an attractive investment destination of ""China plus one”. The hard-working young force with clever hands, the stable political environment and the good relationship with Japan are some of the featur...","31 AUG, 2023 00:57 UTC",4543,Published,,,,,,,,,,,,,,,,,,,
55,piramidal.com.br,It's great for your business. A new cycle of transformation is starting.,"31 AUG, 2023 01:13 UTC",4462,Published,Brasil,Fabricação de plásticos,,,,,,,,,,,,,,,,,
56,antioch.edu,"Antioch University - Los Angeles is ranked #1,033 out of 2,241 schools in the nation that were analyzed for overall quality.","31 AUG, 2023 04:37 UTC",4466,Published,,,,,,,,,,,,,,,,,,,
57,syntech.com.sg,"syntech.com.sg We are a upper-structure specialist in the fabrication, manufacturing, design engineering of commercial heavy industry vehicles of various types of trucks.","31 AUG, 2023 08:14 UTC",4381,Published,,,,,,,,,,,,,,,,,,,
58,chevalerias.com,"For 98 years, the Chevalerias establishments, a family-owned and independent company, have specialized in the distribution of intelligent agricultural and landscape maintenance equipment.","31 AUG, 2023 22:37 UTC",4435,Published,France,Agriculture,,,,,,,,,,,,,,,,,
59,faithfamilyacademy.org,"Oak Cliff Faith Family Academy is an charter elementary/secondary school in Dallas, TX, in the Waxahachie Faith Family Academy school district. As of the 2021-2022 school year, it had 2,325 students.","01 SEP, 2023 08:35 UTC",4359,Published,United States,Education Administration Programs,,,,,,,,,,,,,,,,,
60,dasholding.ae,Das Holding - Business Information Holding Companies & Conglomerates · United Arab Emirates · 129 Employees,"02 SEP, 2023 14:51 UTC",4615,Published,الإمارات العربية المتحدة,Investment Management,,,,,,,,,,,,,,,,,
61,sbhc.us,"Southwest Behavioral Health Center Hospitals & Physicians Clinics · Utah, United States ·","02 SEP, 2023 15:57 UTC",4436,Published,United States,Pharmaceutical Manufacturing,,,,,,,,,,,,,,,,,
62,eljayoil.com,"Eljay Oil - Business Information Electricity, Oil & Gas · Washington, United States ·","02 SEP, 2023 16:08 UTC",4446,Published,United States,Oil and Gas,,,,,,,,,,,,,,,,,
63,scottpartners.com,"Scott + Partners Hospitality · Vermont, United States ·","02 SEP, 2023 16:20 UTC",4358,Published,Australia,Accounting,,,,,,,,,,,,,,,,,
64,beamconstruction.com,"Construction company. 187GB - Financial reports, payment journal, bank statements, tax forms, various accounting documentation - Lists of employees with confidential data (ssn numbers, residential addresses, date of birth, contracts, FMLA forms, s...","06 SEP, 2023 21:55 UTC",4384,Published,United States,Construction,,,,,,,,,,,,,,,,,
65,stavinvest.cz,Meroso Foods has a deep-rooted history as Belgium-based food manufacturer. Different milestones throughout more than 60 years have made the company and its product portfolio what it is today.,"07 SEP, 2023 06:45 UTC",4223,Published,,,,,,,,,,,,,,,,,,,
66,perfectlaw.com,"PerfectLaw® is the most function- and feature-rich legal software that uses a single All-in-One® database for all law office applications. This means you enter your data once and it is immediately available to everyone and every application, subject...","08 SEP, 2023 16:38 UTC",4287,Published,,,,,,,,,,,,,,,,,,,
67,milbermakris.com,"Milber Makris Plousadis & Seiden, LLP is a full-service civil litigation defense firm and business partner to the insurance industry","08 SEP, 2023 16:42 UTC",4297,Published,United States,Law Practice,,,,,,,,,,,,,,,,,
68,pelicanwoodcliff.com,"Welcome to Pelican Woodcliff. We are an independent multi-disciplinary real estate advisory and cost consulting firm. It is our goal to envision, evaluate and excel in order to maximize the success of our clients projects. We enhance the chances of a...","15 SEP, 2023 10:05 UTC",5264,Published,,Real Estate,,,,,,,,,,,,,,,,,
69,carthagehospital.com,"Claxton-Hepburn Medical Center is a private, not-for-profit, 127-bed community hospital and regional referral center. Claxton-Hepburn includes 67 acute-care beds, a 10-bed intensive care unit, a 10-bed birthing center, a 28-bed acute adult mental hea...","14 SEP, 2023 13:11 UTC",6049,Published,United States,Hospitals and Health Care,,,,,,,,,,,,,,,,,
70,clearcreek.org,"There are some things that make Clear Creek who we are. We find our root in the Bible but we stay on mission in our modern world by remembering and focusing on five primary values: Gospel Centrality, Biblical Community, Missional Living, Relentless S...","13 SEP, 2023 19:06 UTC",6376,Published,United States,Financial Services,,,,,,,,,,,,,,,,,
71,sinloc.com,"Sinloc is a consulting and investment firm with operations throughout Italy. We promote development of local infrastructure, providing advisory services, feasibility studies and direct investments in Public-Private Partnerships","12 SEP, 2023 15:09 UTC",6926,Published,Italia,Investment Management,,,,,,,,,,,,,,,,,
72,deeroaks.com,"REVENUE about of 30kk Deer Oaks is a full-service behavioral health organization. It offers a comprehensive employee assistance program, geropsychology services, psychiatric medication, management services, and telemedicine services. The company w...","11 SEP, 2023 18:27 UTC",7466,Published,United States,Mental Health Care,,,,,,,,,,,,,,,,,
73,co.grant.mn.us,The City of Grant is located on the eastern fringe of the Twin Cities' urban core area within west central Washington County.,"11 SEP, 2023 08:09 UTC",7448,Published,United States,Retail Apparel and Fashion,,,,,,,,,,,,,,,,,
74,sd69.org,"In partnership with families and our community, District 69 supports every child's development within an environment of belonging.","08 SEP, 2023 19:29 UTC",9296,Published,,,,,,,,,,,,,,,,,,,
75,monaco-technologies.com,Monaco Technologies is a software and IT Company and has been providing solutions and services for Enterprises & Public Organizations since 2004.,"08 SEP, 2023 16:44 UTC",9776,Published,Monaco,IT Services and IT Consulting,,,,,,,,,,,,,,,,,
76,hanwha.com,"Hanwha continues to grow by quickly anticipating and responding to rapidly changing business environments with a balanced business portfolio that includes aerospace, energy & materials, finance and retail & services. As of 2022, we are the seventh l...","08 SEP, 2023 11:36 UTC",13472,Published,대한민국,Chemical Manufacturing,,,,,,,,,,,,,,,,,
77,gosslaw.com,VETERANS' LAWYER You Deserve Representation and Security. We Focus on Results for U.S. Veterans Worldwide.,"03 SEP, 2023 20:10 UTC",14158,Published,United States,Legal Services,,,,,,,,,,,,,,,,,
78,marianoshoes.com,"A história da Mariano Shoes remonta a 1945, o ano em que Manuel de Almeida Jorge, mestre artesão de calçado, começou a produzir sapatos para homem de alta qualidade, em S. João da Madeira. As suas criações rapidamente ficaram conhecidas em todo o paí...","03 SEP, 2023 20:37 UTC",12716,Published,Portugal,Retail Luxury Goods and Jewelry,,,,,,,,,,,,,,,,,
79,toua.net,"Provides electricity, water, communication and internet services.","07 SEP, 2023 19:52 UTC",10548,Published,,,,,,,,,,,,,,,,,,,
80,ragasa.com.mx,"RAGASA INDUSTRIES, S.A. DE C.V., PROTEINAS NATURALES, S.A. DE C.V., BASIC PROTEINS, S.A. DE C.V., ADMINISTRATIVE AND COMMERCIAL INTEGRAL SERVICES, S.A. DE C.V., CONTROLLING ENTITY, S.A. DE C.V., INMUEBLES RAGAR, S.A. DE C.V., RAUL GARCIA Y CIA., S.A....","06 SEP, 2023 22:45 UTC",11748,Published,México,Servicios de alimentos y bebidas,,,,,,,,,,,,,,,,,
81,qsoftnet.com,"QSOFT's free billing program also includes a free integrated web and virtual store and the WooCommerce, PrestaShop and osCommerce connector. Try its advantages! and discover why our software is the best eCommerce solution. Qsoft is the leading busin...","06 SEP, 2023 22:02 UTC",10788,Published,,,,,,,,,,,,,,,,,,,
82,meroso.be,Meroso Foods has a deep-rooted history as Belgium-based food manufacturer. Different milestones throughout more than 60 years have made the company and its product portfolio what it is today.,"06 SEP, 2023 21:59 UTC",10329,Published,België / Belgique / Belgien,Food and Beverage Manufacturing,,,,,,,,,,,,,,,,,
83,concrejato.com.br,"Created in the 1970s, Concrejato specializes in the execution of technical services for industrial and special works, recovery and structural reinforcement, restoration of historical and architectural heritage, retrofit and maintenance of distributio...","06 SEP, 2023 21:56 UTC",9988,Published,Brasil,Obras de infra-estrutura,,,,,,,,,,,,,,,,,
84,protosign.it,"Protosign Srl Registered office: Via Giuseppe Candiani 98 -20158- Milan n° Company register registration: MI-1714539 - 15/05/2003 Share capital: €10,000.00 iv VAT number: 03949800969","06 SEP, 2023 21:50 UTC",10572,Published,India,Design Services,,,,,,,,,,,,,,,,,
85,nobleweb.com,"Since 1992, The Noble Group has built a dedicated team of professionals all working together to revitalize neighborhoods, provide new homes for families and build a better future for our investors. 260GB lists with ssn numbers, residential addresse...","06 SEP, 2023 21:34 UTC",9641,Published,United States,Real Estate,,,,,,,,,,,,,,,,,
86,gormanusa.com,"Gorman & Company was founded in 1984. They work closely with local governments and community groups to help communities meet their development, planning, economic and social goals.","06 SEP, 2023 21:23 UTC",9326,Published,United States,Real Estate,,,,,,,,,,,,,,,,,
