462,alliedtools.com,"lhdottie.com infantino.com americandawninc.com Allied International was founded in 1962 as an import distributor of hardware products. Over the years, with our unwavering commitment to innovation, quality, value and service, we have earned the r...","27 MAR, 2023 08:41 UTC",20619,Published,United States,Retail,,,,,,,,,,,,,,,,,
463,sakrgroup.net,"Sakr Group is a leading food and beverage supplier in the Middle East, with seven major factories and distribution partnerships that span the MENA region and the whole world. Our brands are loved by millions of consumers and retailers across the glob...","27 MAR, 2023 08:38 UTC",25673,Published,,Food and Beverage Services,,,,,,,,,,,,,,,,,
464,wcso.us,"Washington County Sheriff’s Office official mobile app.We are committed to not only protecting, but also serving the citizens of Washington County with professionalism, integrity, and transparency. A part of that commitment is to provide you with the...","27 MAR, 2023 08:37 UTC",27449,Published,,Government Administration,,,,,,,,,,,,,,,,,
465,bocca-sacs.com,"Discover the food packaging specialist. Bocca-Sacs offers you paper bags, trays, labeling material and all the necessary food packaging.","27 MAR, 2023 08:34 UTC",23479,Published,France,Commerce de gros,,,,,,,,,,,,,,,,,
466,nougat-carlier.be,"For more than half a century, Carlier, a family business, has been making nougat by using the highest quality ingredients, in a wide variety of flavours. It all began in 1949: following the example of his father, a retail confectioner, Rodolphe Carli...","27 MAR, 2023 08:32 UTC",19735,Published,,,,,,,,,,,,,,,,,,,
467,mangalagroup.com,"Mangala Group, is India’s one of the leading enterprises with businesses in the seafood industry. Mangala group was established by Mr. MV Ramachandra Bhat in 1967. Today, the group has grown to be one of most well-known names in the industry producin...","27 MAR, 2023 08:28 UTC",19781,Published,India,Food Production,,,,,,,,,,,,,,,,,
468,nonson.com.vn,Non Son Fashion is the number one leading fashion for Vietnamese. Non Son is always dedicated to his work and also tries his best to offer customers the best products.,"27 MAR, 2023 08:27 UTC",23704,Published,Australia,Maritime Transportation,,,,,,,,,,,,,,,,,
469,ita-moulding-process.com,"ITA MOULDING PROCESS, specialist in wood and foam molding, offers you a complete and diversified offer. Whatever your sector of activity, ITA MOULDING PROCESS adapts to your needs by making you benefit from its expertise.","26 MAR, 2023 19:56 UTC",19653,Published,France,Services relatifs aux bâtiments,,,,,,,,,,,,,,,,,
470,giga.com.vc,"Founded in 2009, GIGA Atacado is a wholesale network with 11 stores and a Distribution Center in the state of São Paulo, present in the capital and the cities of Barueri, Carapicuíba, Cotia, Jundiaí, Guarulhos, Osasco and Várzea Paulista. It has abou...","25 MAR, 2023 21:09 UTC",20926,Published,Singapore,Telecommunications,,,,,,,,,,,,,,,,,
471,demechindia.com,"Deccan Mechanical and Chemical Industries Private Limited (DEMECH) is an ISO 9001:2015 certified company that was established in 1969 by the late Mr. K R Natu. Today, we have a trans-continental presence, serving clients both in India and overseas. O...","25 MAR, 2023 02:51 UTC",20830,Published,India,Mechanical Or Industrial Engineering,,,,,,,,,,,,,,,,,
472,precisionit.co.in,"Established in 1996, Precision provides Biometric, IoT, Cloud & Systems Integration solutions and IT Infrastructure Management Services. Precision adopts a consulting approach to address the needs of clients and has a very strong R&D and IP creation...","25 MAR, 2023 02:38 UTC",20898,Published,Argentina,IT Services and IT Consulting,,,,,,,,,,,,,,,,,
473,securens.in,"Securens has provided leading brands with various security surveillance system, safety and in-camera audit services including Alarm monitoring Services, Perimeter Intrusion detection system, in-camera virtual guard patrol, instantly detecting PPE non...","24 MAR, 2023 13:33 UTC",20900,Published,,Security and Investigations,,,,,,,,,,,,,,,,,
474,bianchiindustry.com,"We are pleased to introduce you two company www.bianchivending.com and www.bianchiindustry.com. They say these are group. Quick overview. Since it was founded in 1959, Bianchi Industry’s industrial strategy has always focused on the future. Und...","24 MAR, 2023 10:31 UTC",18395,Published,Italia,Machinery Manufacturing,,,,,,,,,,,,,,,,,
475,tecnosysitalia.eu,"Tecnosys Italia S.r.l. is a company operating throughout the national territory for over 30 years, in the creation of highly specialized software in the sectors of Real Estate Management, ERP Systems, Document Repository, Process Reengineering (BPR),...","22 MAR, 2023 21:05 UTC",19410,Published,Italia,IT Services and IT Consulting,,,,,,,,,,,,,,,,,
476,kaycan.com,"Home is where we hang our hat at the end of the day and put up our feet up after a long day’s work. It’s no wonder why we take pride in where we live and want our home to reflect our personal style. Kaycan products offer unparalleled performance, mul...","14 MAR, 2023 21:27 UTC",24391,Published,Canada,Wholesale Building Materials,,,,,,,,,,,,,,,,,
477,cabinet-paillet.fr,accountants. people trusted their personal data and no one monitored security,"21 MAR, 2023 20:42 UTC",26419,Published,France,Accounting,,,,,,,,,,,,,,,,,
478,stolt-nielsen.com,"We are the world’s largest operator of sophisticated chemical tankers, a global provider of safe storage services for bulk liquids, and the leading provider of door-to-door transportation services for bulk-liquid chemicals and food-grade products. We...","21 MAR, 2023 10:48 UTC",21484,Published,United States,"Transportation, Logistics, Supply Chain and Storage",,,,,,,,,,,,,,,,,
479,the3rivers.net,The Three Rivers Learning Trust was established in 2011 and consists of eight Schools. These schools have a long and proud history of providing an excellent education service to the local population.,"21 MAR, 2023 10:46 UTC",21062,Published,United Kingdom,Education Administration Programs,,,,,,,,,,,,,,,,,
480,bakermech.com,"Baker Mechanical Inc. is a family-oriented company that prides itself on ensuring unsurpassed customer satisfaction.Centrally located in eastern North Carolina, BMI can handle any size mechanical project in the region. BMI is dedicated to preserving...","21 MAR, 2023 10:45 UTC",20824,Published,United States,Construction,,,,,,,,,,,,,,,,,
481,roslevauto.dk,"Roslev Auto, Auto- & Traktorservice, is a reputable company that has sold, repaired and serviced cars and tractors in Roslev and the surrounding area since 1971. Behind Roslev Auto stands Kjeld Pedersen, who has been the owner and manager of the wor...","21 MAR, 2023 10:37 UTC",24451,Published,,,,,,,,,,,,,,,,,,,
482,cityofallenpark.org,first part of data,"21 MAR, 2023 10:34 UTC",20320,Published,United States,Truck Transportation,,,,,,,,,,,,,,,,,
483,stavinvest.cz,"We are a building supply store that specializes in roofing materials and services. Our products include roofing, insulation, gutters, and battens. Therefore, pretty much anything roof-related. STAV-INVEST was founded in 1992. We have come a lon...","19 MAR, 2023 14:44 UTC",21392,Published,,,,,,,,,,,,,,,,,,,
484,id-logistics.com,"After the launch in France of logistics services for mass distribution, our Group begins its international deployment with a first subsidiary in Taiwan in early 2002. This would be followed by the opening of a new country every year…","19 MAR, 2023 14:37 UTC",21822,Published,United States,"Transportation, Logistics, Supply Chain and Storage",,,,,,,,,,,,,,,,,
485,hitzler-ingenieure.de,The world is changing - and we with it. The German construction industry is facing the greatest upheaval in its history. The megatrends of digitization and sustainability will fundamentally change the industry. And require continuously growing know-...,"19 MAR, 2023 14:27 UTC",21328,Published,Deutschland,Baugewerbe,,,,,,,,,,,,,,,,,
486,bbsautomation.com,"BBS Provides Innovative Advanced Engineering Worldwide BBS is committed to providing engineering solutions which are not only financially feasible and structurally sound, but help improve safety, reliability and profitability. At BBS, assembly auto...","19 MAR, 2023 14:07 UTC",21738,Published,Deutschland,Machinery Manufacturing,,,,,,,,,,,,,,,,,
487,spoormaker.co.za,"SPOORMAKER AND PARTNERS INC | REGISTRATION (CIPC NO): 1981/008290/21. Consultations on mechanics, electrics, fire fighting and sanitation. Designing. There are more than 350Gb of confidential data","19 MAR, 2023 05:02 UTC",21053,Published,South Africa,Engineering Services,,,,,,,,,,,,,,,,,
488,r-pac.com,korea,"17 MAR, 2023 12:15 UTC",24882,Published,United States,Packaging and Containers Manufacturing,,,,,,,,,,,,,,,,,
489,gruppobeltrame.com,"Active in the iron and steel sector since 1896, AFV Gruppo Beltrame is synonymous with excellence and innovation in the production of merchant bars and special profiles for multiple applications: construction, shipyards and excavators. We have a lot...","14 FEB, 2023 23:04 UTC",56642,Published,Italia,Attività minerarie,,,,,,,,,,,,,,,,,
490,sabena-engineering.com,"Sabena Engineering is your reference for Maintenance, Repair, Overhaul & Upgrades. We support airlines and air forces around the globe. With our experienced engineers, technicians and mechanics, your fleet is in safe hands. We will attach proofs of...","13 MAR, 2023 21:55 UTC",44697,Published,België / Belgique / Belgien,Airlines and Aviation,,,,,,,,,,,,,,,,,
491,essendant.com,"Essendant, formerly known as United Stationers, is a national wholesale distributor of office supplies, with consolidated net sales of $5.3 billion. Essendant stocks over 160,000 items including traditional office products, office furniture, janitori...","14 MAR, 2023 21:57 UTC",22976,Published,United States,Wholesale,,,,,,,,,,,,,,,,,
492,ktcs.com.my,"Kilang Tin Can (Sel) Sdn Bhd (雪蘭莪製罐廠有限公司), incorporated in 1976, is a metal can manufacturing company located at Jalan Haji Sirat, Klang, Selangor.","16 MAR, 2023 17:36 UTC",21284,Published,United States,Entertainment,,,,,,,,,,,,,,,,,
493,boothtransport.com,"Booth is one of Australia's most respected national freight and logistics service providers. Our national fleet of transport equipment, warehousing facilities and professional staff are supported by industry specific operational systems. This deliver...","16 MAR, 2023 17:29 UTC",20852,Published,Australia,Truck Transportation,,,,,,,,,,,,,,,,,
494,radium.com.tw,"Radium Life Technology Co., Ltd. is developing real estate projects in Taiwan. It develops and operates the T9 BOT project, which consists of a bus terminal, four residential buildings, two office towers, a shopping mall, a hotel, and a movie theater","16 MAR, 2023 09:42 UTC",24250,Published,United States,Broadcast Media Production and Distribution,,,,,,,,,,,,,,,,,
495,buehnen.de,"Wenn wir Ihr Ziel kennen, stellen wir die richtigen Fragen und liefern das optimale Ergebnis für eine sichere und optimale Klebung Ihrer Komponenten. Für uns stehen nicht unsere Produkte im Fokus, sondern das belastbar beste Ergebnis für unsere Kunde...","16 MAR, 2023 09:21 UTC",21143,Published,Deutschland,Chemical Manufacturing,,,,,,,,,,,,,,,,,
496,meatel.com,"Established in 1977, Meatel is a leading innovative Telecommunication, ICT and security provider and Integrator for the Public and the Private Sectors, including fixed and mobile operators. We offer a suite of services and solutions from design, supp...","16 MAR, 2023 09:18 UTC",20693,Published,,اتصالات,,,,,,,,,,,,,,,,,
497,mandirisekuritas.co.id,Mandiri Sekuritas merupakan mitra investasi tepercaya yang menyediakan solusi pasar modal komprehensif dengan beragam produk dan layanan unggulan,"16 MAR, 2023 09:05 UTC",130299,Published,,,,,,,,,,,,,,,,,,,
498,waldogeneral.com,"Waldo General, Inc. is a management company specializing in the management of Associated Business Units; most of which operate in the financial services industry. Waldo General, Inc.'s portfolio of businesses that it manages include storefront consum...","16 MAR, 2023 09:03 UTC",21021,Published,United States,Business Consulting and Services,,,,,,,,,,,,,,,,,
499,perfectplacement.co.uk,recruitment agency,"16 MAR, 2023 09:00 UTC",20059,Published,,Human Resources Services,,,,,,,,,,,,,,,,,
500,regaltax.us,"Regal Tax Advisory Group has been in business for more than 14 years. We are proud to say that we have delivered satisfaction and excellence, not just in Doral, FL and Miramar, FL, but also throughout the United States. The services we provide are al...","16 MAR, 2023 06:58 UTC",20777,Published,United States,Accounting,,,,,,,,,,,,,,,,,
501,emotorsdirect.ca,"Shop the largest selection of industrial motors, controls, and gear reducers in Canada. We deliver to every postal code in Canada. We specialize in getting you the best product for the job - as fast as possible. You need the right motor, and you...","14 MAR, 2023 18:41 UTC",18655,Published,Canada,Wholesale,,,,,,,,,,,,,,,,,
502,fiege.com,"259gb stolen data Integrated solutions including logistics, digital services, real estate and venture business. We are innovation leaders in logistics. With our modular concepts in logistics, digital services, real estate and enterprises, we opti...","14 MAR, 2023 16:08 UTC",25348,Published,Deutschland,"Transport, Logistik, Lieferkette und Lagerhaltung",,,,,,,,,,,,,,,,,
503,maximumind.com,I would say we were lucky if SPACE-X contractors were more talkative. But I think this material will find its buyer as soon as possible. Elon Musk we will help you sell your drawings to other manufacturers - build the ship faster and fly away....,"13 MAR, 2023 19:26 UTC",22984,Published,United States,Industrial Machinery Manufacturing,,,,,,,,,,,,,,,,,
504,plasticproductsco.com,"Last chance Founded in 1962, Plastic Products is a company that specializes in providing plastic, metal, and ceramic injection molding services.","13 MAR, 2023 17:21 UTC",22919,Published,United States,Plastics Manufacturing,,,,,,,,,,,,,,,,,
505,jaureguy.com.ar,"Jaureguy S.A.C. I. y A. is a company with more than 20 years of experience making and selling soda in disposable siphons. Jaureguy has their own fleet for the logistics of their products and a Distribution Center located in San Justo, La Matanza, Bu...","12 MAR, 2023 17:00 UTC",19156,Published,,,,,,,,,,,,,,,,,,,
506,schradercamargo.com,"Founded in 1963, Schrader Camargo is an engineering, procurement, and construction company. Other services Schrader Camargo offers include civil works, electromechanical assemblies, and operation and maintenance in the hydrocarbons","11 MAR, 2023 12:10 UTC",26734,Published,Colombia,Construction,,,,,,,,,,,,,,,,,
507,grupohospitalarvidas.com.br,Hospital e Maternidade Vidas is a company that operates in the Hospital & Health Care industry.,"11 MAR, 2023 12:07 UTC",26793,Published,Brasil,Hospitais e atendimento à saúde,,,,,,,,,,,,,,,,,
508,bonta-viva.it,Bonta Viva's authentic Italian cow milk cheese made from mozzarella and cream,"11 MAR, 2023 10:55 UTC",23078,Published,Italia,Produzione lattiero-casearia,,,,,,,,,,,,,,,,,
509,wyckoffcomfort.com,Wyckoff Heating & Cooling is always growing.,"11 MAR, 2023 10:44 UTC",22806,Published,United States,Consumer Services,,,,,,,,,,,,,,,,,
510,greggardnergm.com,"Shopping for a new or pre-owned GM vehicle? Shop for GMC, Buick, and Chevrolet models at Greg Gardner Motors, located in Squamish, BC.","11 MAR, 2023 10:40 UTC",22396,Published,Canada,Retail,,,,,,,,,,,,,,,,,
511,lubrimetal.com,Lubrimetal is a chemical company specializing in the production of lubricants and other chemicals for wire drawing and metal surface treatment.,"11 MAR, 2023 10:36 UTC",22201,Published,Italia,Chemical Manufacturing,,,,,,,,,,,,,,,,,
512,meinet.com,"ManagementExcellence, Inc. (MEI) has a solid track record in providing management services to membership organizations, bringing a unique set of skills and expertise to the table. We work in conjunction with several strategic partners who have specif...","11 MAR, 2023 10:31 UTC",22072,Published,,,,,,,,,,,,,,,,,,,
513,brandywine-homes.com,"Brandywine Homes is the builder of choice throughout Southern California, creating extraordinary homes built to last today and for generations to come.","11 MAR, 2023 10:24 UTC",22866,Published,,,,,,,,,,,,,,,,,,,
514,cqservice.sk,"Spoločnosť CQ service, spol. s r.o. pôsobí na trhu informačných technológií už od roku 1992. Po úvodných rokoch dodávok výpočtovej techniky sa začala orientovať aj na poskytovanie služieb spojených s výpočtovou technikou.","11 MAR, 2023 10:22 UTC",22080,Published,Slovensko,Information Technology & Services,,,,,,,,,,,,,,,,,
515,inphenix.com,"Inphenix designs and manufactures lasers and light sources that are critical in state of the art applications in the medical, telecom, sensing and measurement industries.","11 MAR, 2023 10:18 UTC",21363,Published,United States,Telecommunications,,,,,,,,,,,,,,,,,
516,omegaservicos.com.br,The Omega Group develops customized solutions for your business,"11 MAR, 2023 10:15 UTC",24381,Published,Brasil,Security and Investigations,,,,,,,,,,,,,,,,,
517,cktc.edu,"CKTC was one of the first technology centers in the state. Contractors completed construction on building 100 in September 1968, and Caddo Kiowa Technology Center opened its doors to the public for the first time that year. CKTC offered 11 programs t...","11 MAR, 2023 10:11 UTC",12843,Published,السعودية,Professional Training and Coaching,,,,,,,,,,,,,,,,,
518,favoritefoods.com,"The Mission of Favorite Foods is to provide quality products, superior service and innovative solutions to a select group of customers, and to make a significant contribution to their success. We strive to create mutually profitable long term relatio...","11 MAR, 2023 09:26 UTC",21232,Published,United States,Food and Beverage Services,,,,,,,,,,,,,,,,,
519,eprinsa.es,"Eprinsa is a public company created by the Diputación de Córdoba with the aim of providing comprehensive computer assistance, staff training and cartographic production.","10 MAR, 2023 19:56 UTC",21670,Published,,Government Administration,,,,,,,,,,,,,,,,,
520,micos.com,"Micos Engineering GmbH is an independent advanced engineering company that focuses on optical instrumentation for the European space market. As industrial partner it delivers (pre-) design, engineering, AIT (assembly, integration and testing) and ser...","10 MAR, 2023 12:34 UTC",25158,Published,Australia,Construction,,,,,,,,,,,,,,,,,
521,drilmaco.com,"Drilmaco specializes in deep hole drilling & honing, CNC lathe machining and milling operations. Specifically, we provide material sizing by the following processes: Turning Drilling Boring Milling Threading (TPCQ(EX), API, etc..)","10 MAR, 2023 12:23 UTC",20414,Published,,Oil and Gas,,,,,,,,,,,,,,,,,
522,heidelbergbread.com,"At Heidelberg Bread Company we promise to provide health conscious consumers with fresh, all natural, artisan breads made from sustainably sourced ingredients baked under Orthodox Union kosher standards that have an old world taste, and sold at an af...","10 MAR, 2023 12:12 UTC",24549,Published,United States,Wholesale,,,,,,,,,,,,,,,,,
523,schauenburg.com,"Schauenburg Industries Ltd. of North Bay, Ontario, Canada, is a Schauenburg Group company. Founded in 1969 in the heart of Canada's mining district, the company continues to supply products to the mining, tunneling, forestry and other industries.","10 MAR, 2023 12:10 UTC",21479,Published,Deutschland,Mining,,,,,,,,,,,,,,,,,
524,alpes-sante-travail.org,"Alpes Santé Travail est constitué en association loi 1901, au service de 4 700 entreprises adhérentes et 63 000 salariés, soumis à un renouvellement d’agrément tous les 5 ans par la DREETS. Notre agrément a été renouvelé le 19 janvier 2020 pour l’en...","10 MAR, 2023 12:03 UTC",33573,Published,France,Organismes civiques et sociaux,,,,,,,,,,,,,,,,,
525,kisp.com,"KiSP creates, develops and provides client-facing solutions to manufacturers, dealers, interior designers and customers in the office furniture industry. Founded in 1993, KiSP is headquartered in Toronto, Canada, with additional offices in Costa...","10 MAR, 2023 11:59 UTC",20519,Published,Canada,Design Services,,,,,,,,,,,,,,,,,
526,pmsoffice.de,"The hotel software hotline is the award-winning hotel program for small and large hotels, with individual extensions and TSE certification. Data related hotline software and hotels they cooperate.","09 MAR, 2023 22:26 UTC",21039,Published,,Government Administration,,,,,,,,,,,,,,,,,
527,audio-technica.com,"Audio-Technica was founded in Japan on 17th April 1962 by Hideo Matsushita. After operating from a small flat above a ramen shop in Shinjuku, Audio-Technica opened a larger headquarters in Machida, Tokyo, where the company still operates today.","09 MAR, 2023 05:56 UTC",31245,Published,United States,Computers and Electronics Manufacturing,,,,,,,,,,,,,,,,,
528,mcna.net,"MCNA Dental (MCNA Insurance Company and Managed Care of North America, Inc.) is a leading dental benefits manager committed to providing high quality services to state agencies and managed care organizations for their Medicaid, Children's Health Insu...","07 MAR, 2023 09:11 UTC",21488,Published,,Insurance,,,,,,,,,,,,,,,,,
529,gdz.com,"Fully integrated shipping line software. Provides a complete platform for managing the commercial and operational aspects of ocean carriers and agents. As a result of the attack on the this company, we also attacked its customers. In addition to the...","07 MAR, 2023 06:41 UTC",24720,Published,France,"Movies, Videos, and Sound",,,,,,,,,,,,,,,,,
530,hendrickcorp.com,"Hendrick's customer service, engineering capabilities and manufacturing expertise are second to none. Our commitment to lean manufacturing methods is a testament to our dedication to providing our customers the best product. With 145+ years of manufa...","06 MAR, 2023 20:09 UTC",18608,Published,,,,,,,,,,,,,,,,,,,
531,greekpeak.net,"WELCOME TO GREEK PEAK Greek Peak Mountain Resort, central New York's largest ski resort was founded in 1958 and has remained at the leading edge of the ski industry with fifty-six trails, six chair lifts, two surface lifts, beginners' slope, and terr...","13 FEB, 2023 06:49 UTC",27079,Published,United States,Hospitality,,,,,,,,,,,,,,,,,
532,nicklaus.com,"Partner Spotlight: Nicklaus Companies extends landmark agreement with Japan's Kosugi, Inc. To reach 50 years. The Nicklaus Companies and its largest worldwide licensee, Kosugi Inc., today announced a historic long-term contract extension to manufactu...","06 FEB, 2023 12:41 UTC",31005,Published,,,,,,,,,,,,,,,,,,,
533,ascentengrs.com,,"02 MAR, 2023 05:04 UTC",24242,Published,,"Appliances, Electrical, and Electronics Manufacturing",,,,,,,,,,,,,,,,,
534,jams.edu.jo,"JAMS is a quality focused maritime institution providing comprehensive services of Maritime Education and Training (MET) while committed to customers, employees, owners and the maritime community in general.","06 FEB, 2023 13:15 UTC",35900,Published,,,,,,,,,,,,,,,,,,,
535,nlsmichigan.org,Neighborhood Legal Services Michigan (NLSM) offers one-of-a-kind services to promote health safety and self-sufficiency. We are a regional business and non-profit collaborative coordinating Southeastern Michigan community outreach and pro-bono partne...,"02 FEB, 2023 21:58 UTC",28565,Published,United States,Non-profit Organizations,,,,,,,,,,,,,,,,,
536,prlabs.com,"For many years, Premier Research Labs has had a sterling reputation as the world's leader in cellular resonant nutrition technology. We have strived to become the industry leader in excipient-free, preservative-free, premier quality nutritional produ...","06 FEB, 2023 12:45 UTC",27981,Published,United States,Wellness and Fitness Services,,,,,,,,,,,,,,,,,
537,bethrivkah.edu,"Founded in 1941 by the previous Lubavitcher Rebbe, Rabbi Yosef I. Schneerson, and led by Rebbe Menachem Mendel Schneerson, Bet Rivka was the world's first Hasidic school for girls. Today, Beth Rivkah has over 2,000 students enrolled in our preschool...","02 FEB, 2023 23:09 UTC",29131,Published,Australia,Education Administration Programs,,,,,,,,,,,,,,,,,
538,scandia.ro,"Scandia Food is the market leader in meat-based canned food in Romania, leading the liver pâté category with a volume market share of over 43% (source: AC Nielsen, AS 2018), but also covering other segments such as vegetable pâté, meat and canned foo...","02 FEB, 2023 22:51 UTC",27983,Published,Nederland,Apparel Manufacturing,,,,,,,,,,,,,,,,,
539,kostika.co.il,"Stolen 250gb Decades of years in the industry, combined with unique abilities, Give the Kostica group the opportunity to translate the language of architects For practical construction solutions that fulfill any plan, at any height, in any shape...","02 FEB, 2023 22:45 UTC",28298,Published,,,,,,,,,,,,,,,,,,,
540,elsan.care,"stolen: 821 GB. data: marketing, finance, information of all departments of one of the company's clinics, numbers, personal data of employees, contracts, reports, internal and external contracts with policyholders, subsidiaries, etc. Elsan is a m...","24 JAN, 2023 12:26 UTC",28256,Published,,,,,,,,,,,,,,,,,,,
541,newbridge.org,"Founded in 1963, NewBridge Services is a non-profit organization that provides mental healthcare services to individuals of all ages.","16 FEB, 2023 09:28 UTC",24929,Published,Singapore,Human Resources,,,,,,,,,,,,,,,,,
